<?xml version="1.0" encoding="UTF-8"?>
<!-- Copyright DASSAULT SYSTEMES 2013 -->
<Config version="2.0" xmlns="DS_DELPPWConfiguration" xmlns:xsi="http://www.w3.org/2001/XMLSchema-instance" xsi:schemaLocation="DS_DELPPWConfiguration ../xsd/EGraphViewReferenceAttribute.xsd" Title="GraphView reference attributes preferences" Description="Sample configuration file delivered by DS.">
    <Preferences>
            <Primary>
                <Attribute name="V_Name" dicoType="PLMEntity"/>
            </Primary>
            <Secondary>
                <Attribute name="type"/>
                <Attribute name="revision"/>
                <!--<Attribute name="CGJMyAttribute1" dicoType="CGJMyDeploymentExtension"/> -->
            </Secondary>
            <Image value="true"/>
    </Preferences>
</Config>
